{
  "$schema": "https://json-schema.org/draft/2020-12/schema",
  "$id": "https://peppy6582.github.io/jellydisc-menus/schema/v1/listing.schema.json",
  "title": "Catalogue listing (sidecar to a menu)",
  "description": "Catalogue-only details about one menu. Lives beside it as <menuId>.listing.json. The menu file itself is unchanged and is exactly what the plugin loads. Written by the author; build-time facts (hash, size, features) are computed, never written here.",
  "type": "object",
  "additionalProperties": false,
  "required": ["listingVersion", "menuId", "title", "description", "licence", "author", "artSources"],
  "properties": {
    "listingVersion": { "const": 1 },
    "menuId": { "description": "Must equal the menuId of the menu file beside it (lower-case).", "type": "string", "pattern": "^[0-9a-f]{8}-[0-9a-f]{4}-[0-9a-f]{4}-[0-9a-f]{4}-[0-9a-f]{12}$" },
    "title": { "description": "The film or series name as shown on the site. Authoritative: the site never looks titles up elsewhere.", "$ref": "#/$defs/text120" },
    "originalTitle": { "$ref": "#/$defs/text120" },
    "description": { "description": "One or two plain sentences about the menu's look. No markup.", "type": "string", "minLength": 1, "maxLength": 280, "pattern": "^[^<>\\u0000-\\u001f\\u007f]+$" },
    "tags": {
      "type": "array",
      "maxItems": 8,
      "uniqueItems": true,
      "items": { "type": "string", "pattern": "^[a-z0-9][a-z0-9-]{0,23}$" }
    },
    "licence": { "description": "Every menu in the catalogue is dedicated to the public domain.", "const": "CC0-1.0" },
    "author": {
      "type": "object",
      "additionalProperties": false,
      "required": ["name"],
      "properties": {
        "name": { "$ref": "#/$defs/text64" },
        "github": { "description": "GitHub username, if the author wants to be credited with a link.", "type": "string", "pattern": "^[A-Za-z0-9](?:[A-Za-z0-9-]{0,38})$" }
      }
    },
    "artSources": {
      "description": "Where any artwork the menu refers to comes from, or the single word \"none\" if it refers to none. A menu that refers to asset: files must say where they come from.",
      "type": "string",
      "minLength": 4,
      "maxLength": 300,
      "pattern": "^[^<>\\u0000-\\u001f\\u007f]+$"
    },
    "changelog": {
      "description": "What changed in each revision after the first.",
      "type": "array",
      "maxItems": 100,
      "items": {
        "type": "object",
        "additionalProperties": false,
        "required": ["revision", "date", "notes"],
        "properties": {
          "revision": { "type": "integer", "minimum": 1 },
          "date": { "type": "string", "pattern": "^\\d{4}-\\d{2}-\\d{2}$" },
          "notes": { "type": "string", "minLength": 1, "maxLength": 200, "pattern": "^[^<>\\u0000-\\u001f\\u007f]+$" }
        }
      }
    },
    "demo": { "description": "True for sample menus made to show off the format. The site hides them by default, because they are for real titles.", "type": "boolean" }
  },
  "$defs": {
    "text64": { "type": "string", "minLength": 1, "maxLength": 64, "pattern": "^[^<>\\u0000-\\u001f\\u007f]+$" },
    "text120": { "type": "string", "minLength": 1, "maxLength": 120, "pattern": "^[^<>\\u0000-\\u001f\\u007f]+$" }
  }
}
