{
  "listingVersion": 1,
  "menuId": "24284908-2c95-4dc7-9bad-8284ff8188c5",
  "title": "Spirited Away",
  "description": "A flat colour background with centred serif text that glows, across three menu levels with Back and Home.",
  "tags": [
    "solid-colour",
    "serif",
    "glow"
  ],
  "licence": "CC0-1.0",
  "author": {
    "name": "peppy6582",
    "github": "peppy6582"
  },
  "artSources": "none",
  "demo": true
}
