{
  "listingVersion": 1,
  "menuId": "14a94979-3907-4968-b22b-1854ccdcc47b",
  "title": "The Matrix",
  "description": "The original minimal example: a bottom row of buttons and a lower menu tree, over the title's backdrop.",
  "tags": [
    "minimal",
    "bottom-row"
  ],
  "licence": "CC0-1.0",
  "author": {
    "name": "peppy6582",
    "github": "peppy6582"
  },
  "artSources": "none",
  "demo": true
}
